{
  "$schema": "http://json-schema.org/draft-07/schema#",
  "$id": "https://github.com/GFCDOTA/sketchup-mcp/blob/develop/fixtures/planta_74/human_walls_truth.schema.json",
  "title": "Human walls ground truth",
  "description": "Machine-readable ground truth for STRUCTURAL WALLS the reviewer paints on a planta render. These walls are added to consensus.walls with geometry_origin='human_annotation' so polygonize_rooms can form the correct cells when the stage-1 wall extractor misses dividers. Companion to fixtures/planta_74/human_openings_truth.schema.json (openings).",
  "type": "object",
  "required": ["schema_version", "source_image", "image_size_px", "color_mapping", "consensus_wall_thickness_pts", "walls"],
  "properties": {
    "schema_version": {"const": "1.0"},
    "source_image": {"type": "string"},
    "image_size_px": {
      "type": "array",
      "items": {"type": "integer"},
      "minItems": 2, "maxItems": 2
    },
    "color_mapping": {
      "type": "object",
      "description": "RGB → kind. Default contract: BLUE #0000ff and PURPLE #8000ff both map to structural_wall.",
      "additionalProperties": {
        "type": "object",
        "required": ["rgb", "kind"],
        "properties": {
          "rgb": {"type": "array", "items": {"type": "integer", "minimum": 0, "maximum": 255}, "minItems": 3, "maxItems": 3},
          "kind": {"const": "structural_wall"}
        }
      }
    },
    "calibration": {
      "type": "object",
      "description": "Affine transform image-px ↔ PDF-pt computed by auto-calibrate. Saved so downstream tools can reproduce the projection."
    },
    "consensus_wall_thickness_pts": {
      "type": "number",
      "description": "Wall thickness pulled from the consensus this truth was extracted against. New human walls inherit this thickness — no invention."
    },
    "walls": {
      "type": "array",
      "items": {
        "type": "object",
        "required": ["id", "orientation", "start", "end", "thickness"],
        "properties": {
          "id": {"type": "string", "pattern": "^h_w\\d{3}$"},
          "color": {"enum": ["blue", "purple"]},
          "bbox_px": {"type": "array", "items": {"type": "number"}, "minItems": 4, "maxItems": 4},
          "bbox_pts": {"type": "array", "items": {"type": "number"}, "minItems": 4, "maxItems": 4},
          "orientation": {"enum": ["h", "v"]},
          "start": {"type": "array", "items": {"type": "number"}, "minItems": 2, "maxItems": 2},
          "end": {"type": "array", "items": {"type": "number"}, "minItems": 2, "maxItems": 2},
          "thickness": {"type": "number", "minimum": 0},
          "geometry_origin": {"const": "human_annotation"}
        }
      }
    }
  }
}
